{
  "adapter_matrix": [
    {
      "advanced_to_full": false,
      "config": {
        "hard_negatives": 4,
        "id": "s100-r8-n4-t003",
        "lora_rank": 8,
        "max_steps": 100,
        "temperature": 0.03
      },
      "id": "s100-r8-n4-t003",
      "pilot_decision": {
        "advance_eligible": false,
        "boundary": "Pilot advancement uses mean deltas only. It authorises at most two fixed full-validation runs and is not a promotion claim.",
        "mean_deltas": {
          "evidence_f1": 0.0,
          "mrr@10": 0.0,
          "ndcg@10": 0.0,
          "recall@5": 0.0
        }
      },
      "pilot_metrics_sha256": "04891c8fc609f372147909a9413490b524a0278d8e4cb2271c5c7c8e89b6a78f"
    },
    {
      "advanced_to_full": false,
      "config": {
        "hard_negatives": 8,
        "id": "s100-r8-n8-t005",
        "lora_rank": 8,
        "max_steps": 100,
        "temperature": 0.05
      },
      "id": "s100-r8-n8-t005",
      "pilot_decision": {
        "advance_eligible": false,
        "boundary": "Pilot advancement uses mean deltas only. It authorises at most two fixed full-validation runs and is not a promotion claim.",
        "mean_deltas": {
          "evidence_f1": 0.0,
          "mrr@10": 0.0,
          "ndcg@10": 0.0,
          "recall@5": 0.0
        }
      },
      "pilot_metrics_sha256": "7318a1c579cabe61e8b75e599fa74bf393d58832ec5ec159af2141def735067d"
    },
    {
      "advanced_to_full": true,
      "config": {
        "hard_negatives": 4,
        "id": "s100-r16-n4-t005",
        "lora_rank": 16,
        "max_steps": 100,
        "temperature": 0.05
      },
      "id": "s100-r16-n4-t005",
      "pilot_decision": {
        "advance_eligible": false,
        "boundary": "Pilot advancement uses mean deltas only. It authorises at most two fixed full-validation runs and is not a promotion claim.",
        "mean_deltas": {
          "evidence_f1": 0.0,
          "mrr@10": 0.0,
          "ndcg@10": 0.0,
          "recall@5": 0.0
        }
      },
      "pilot_metrics_sha256": "d9837e556631cd8ebbb8f4e152353e4f1b779d8a13aba1a39eef7d4520d639e0"
    },
    {
      "advanced_to_full": false,
      "config": {
        "hard_negatives": 8,
        "id": "s300-r8-n8-t003",
        "lora_rank": 8,
        "max_steps": 300,
        "temperature": 0.03
      },
      "id": "s300-r8-n8-t003",
      "pilot_decision": {
        "advance_eligible": false,
        "boundary": "Pilot advancement uses mean deltas only. It authorises at most two fixed full-validation runs and is not a promotion claim.",
        "mean_deltas": {
          "evidence_f1": 0.0,
          "mrr@10": 0.0,
          "ndcg@10": 0.0,
          "recall@5": 0.0
        }
      },
      "pilot_metrics_sha256": "451f3f1525f945f169bb7de3d87c16cc12905748d0b523fcf2b64c1ac89fc9fd"
    },
    {
      "advanced_to_full": false,
      "config": {
        "hard_negatives": 4,
        "id": "s300-r16-n4-t003",
        "lora_rank": 16,
        "max_steps": 300,
        "temperature": 0.03
      },
      "id": "s300-r16-n4-t003",
      "pilot_decision": {
        "advance_eligible": false,
        "boundary": "Pilot advancement uses mean deltas only. It authorises at most two fixed full-validation runs and is not a promotion claim.",
        "mean_deltas": {
          "evidence_f1": 0.0,
          "mrr@10": 0.0,
          "ndcg@10": 0.0,
          "recall@5": 0.0
        }
      },
      "pilot_metrics_sha256": "c7f8c0a78da613e0f24c9ca2049ef229ea20bc501e8a1c104cf88edd356035d3"
    },
    {
      "advanced_to_full": false,
      "config": {
        "hard_negatives": 8,
        "id": "s300-r16-n8-t005",
        "lora_rank": 16,
        "max_steps": 300,
        "temperature": 0.05
      },
      "id": "s300-r16-n8-t005",
      "pilot_decision": {
        "advance_eligible": false,
        "boundary": "Pilot advancement uses mean deltas only. It authorises at most two fixed full-validation runs and is not a promotion claim.",
        "mean_deltas": {
          "evidence_f1": 0.0,
          "mrr@10": 0.0,
          "ndcg@10": 0.0,
          "recall@5": 0.0
        }
      },
      "pilot_metrics_sha256": "565931988d8db5e2894d034491ebc206cf61ddc88eab0cc7328018cd7c1a3486"
    }
  ],
  "artifact_hashes": {
    "base_metrics_sha256": "09ad50c6ea0afd02905371fd38bb4e9bfdeefa87ddb270623a6cbcc36ad34601",
    "downstream_metrics_sha256": "749461a0f50dce7046cd5787170512d115b08459d6dfb983061e36e1b3cebf17",
    "full_selection_sha256": "dbd0f5cf81f65f6af9313e9b77d5479763b93826962a3ac3097b88d25c7e8944",
    "pilot_selection_sha256": "ed18dd168795eb51ecba987bfd451e200976855717605a512f31fad074e766b2",
    "prepare_metrics_sha256": "2a1b91e7175154285f9f003e2eb5707df1bc9900060c2827b252c1c1afbc2500",
    "sacct_sha256": "b0620c537ae25ed8bba071cefbc0d4b3cc5553c650e402baedd85809dbef8ffd"
  },
  "baselines": {
    "bm25": {
      "claim_accuracy": 0.0,
      "claim_count": 126,
      "evidence_f1": 0.29126984126984123,
      "evidence_precision": 0.2349206349206349,
      "evidence_recall": 0.44007936507936507,
      "final_k": 5,
      "harmonic_mean": 0.0,
      "hit_rate@10": 0.626984126984127,
      "hit_rate@5": 0.626984126984127,
      "index_build_seconds": 0.13395239412784576,
      "index_bytes": 735667,
      "labelled_claim_count": 126,
      "mrr@10": 0.4871693121693121,
      "ndcg@10": 0.39660782195128885,
      "recall@10": 0.44007936507936507,
      "recall@5": 0.44007936507936507,
      "search_p50_ms": 1.1585308238863945,
      "search_p95_ms": 2.3985637817531824
    },
    "dense_vs_bm25": {
      "baseline": {
        "evidence_f1": 0.29126984126984123,
        "mrr@10": 0.4871693121693121,
        "ndcg@10": 0.39660782195128885,
        "recall@5": 0.44007936507936507
      },
      "bootstrap_samples": 5000,
      "candidate": {
        "evidence_f1": 0.373015873015873,
        "mrr@10": 0.5908730158730158,
        "ndcg@10": 0.524053869420587,
        "recall@5": 0.593915343915344
      },
      "paired_bootstrap": {
        "evidence_f1": {
          "baseline_mean": 0.29126984126984123,
          "candidate_mean": 0.373015873015873,
          "ci_lower": 0.043429547745023944,
          "ci_upper": 0.12042076089695136,
          "mean_difference": 0.08174603174603175,
          "pair_count": 126,
          "samples": 5000,
          "two_sided_p": 0.0
        },
        "mrr@10": {
          "baseline_mean": 0.4871693121693121,
          "candidate_mean": 0.5908730158730158,
          "ci_lower": 0.032007275132275144,
          "ci_upper": 0.17605820105820102,
          "mean_difference": 0.10370370370370369,
          "pair_count": 126,
          "samples": 5000,
          "two_sided_p": 0.0036
        },
        "ndcg@10": {
          "baseline_mean": 0.39660782195128885,
          "candidate_mean": 0.524053869420587,
          "ci_lower": 0.06866445333114998,
          "ci_upper": 0.18713858910282327,
          "mean_difference": 0.12744604746929802,
          "pair_count": 126,
          "samples": 5000,
          "two_sided_p": 0.0
        },
        "recall@5": {
          "baseline_mean": 0.44007936507936507,
          "candidate_mean": 0.593915343915344,
          "ci_lower": 0.08822751322751322,
          "ci_upper": 0.22129960317460315,
          "mean_difference": 0.15383597883597883,
          "pair_count": 126,
          "samples": 5000,
          "two_sided_p": 0.0
        }
      },
      "query_count": 126,
      "seed": 20260903,
      "taxonomy": {
        "entity": {
          "baseline": {
            "evidence_f1": 0.4307334428024083,
            "mrr@10": 0.660919540229885,
            "ndcg@10": 0.5672832895311124,
            "recall@5": 0.6373563218390805
          },
          "candidate": {
            "evidence_f1": 0.4367816091954023,
            "mrr@10": 0.7298850574712643,
            "ndcg@10": 0.6141062990984751,
            "recall@5": 0.6666666666666665
          },
          "mean_delta": {
            "evidence_f1": 0.00604816639299397,
            "mrr@10": 0.06896551724137931,
            "ndcg@10": 0.04682300956736267,
            "recall@5": 0.029310344827586203
          },
          "query_count": 29
        },
        "geographic": {
          "baseline": {
            "evidence_f1": 0.2781874039938556,
            "mrr@10": 0.453494623655914,
            "ndcg@10": 0.36818970256228184,
            "recall@5": 0.40645161290322573
          },
          "candidate": {
            "evidence_f1": 0.3826676907322069,
            "mrr@10": 0.5685483870967742,
            "ndcg@10": 0.5105595948135506,
            "recall@5": 0.5870967741935482
          },
          "mean_delta": {
            "evidence_f1": 0.10448028673835126,
            "mrr@10": 0.11505376344086021,
            "ndcg@10": 0.1423698922512689,
            "recall@5": 0.1806451612903226
          },
          "query_count": 62
        },
        "lexical_mismatch": {
          "baseline": {
            "evidence_f1": 0.1545186891961086,
            "mrr@10": 0.2139784946236559,
            "ndcg@10": 0.2002593373260167,
            "recall@5": 0.2704301075268817
          },
          "candidate": {
            "evidence_f1": 0.2801075268817204,
            "mrr@10": 0.4193548387096774,
            "ndcg@10": 0.40934655386464497,
            "recall@5": 0.5126344086021506
          },
          "mean_delta": {
            "evidence_f1": 0.12558883768561188,
            "mrr@10": 0.2053763440860215,
            "ndcg@10": 0.2090872165386282,
            "recall@5": 0.2422043010752688
          },
          "query_count": 62
        },
        "multi_evidence": {
          "baseline": {
            "evidence_f1": 0.3674157303370786,
            "mrr@10": 0.600936329588015,
            "ndcg@10": 0.4615243520011641,
            "recall@5": 0.4882022471910112
          },
          "candidate": {
            "evidence_f1": 0.453183520599251,
            "mrr@10": 0.6853932584269663,
            "ndcg@10": 0.5725743348856726,